{
  "title": "Fractionation and Hyperfractionation",
  "category": "Radiation Oncology", 
  "section": "Radiobiology",
  "summary": "Essential radiobiological concepts in Fractionation and Hyperfractionation for clinical application.",
  "content": [
    {
      "type": "heading",
      "level": 2,
      "text": "Biological Principles"
    },
    {
      "type": "paragraph",
      "text": "This topic covers essential radiobiological concepts for radiation therapy."
    },
    {
      "type": "clinical_pearl", 
      "text": "Understanding radiobiological principles guides optimal fractionation and treatment approaches."
    }
  ]
}
